Class Index,Title,Description
10,Harmony included in the 2023 Bloomberg Gender-Equality Index for the fifth consecutive year,"Johannesburg. Tuesday, 31 January 2023. Harmony Gold Mining Company Limited (“Harmony” or the “Company”) is pleased to announce that it has been included in the 2023 Bloomberg Gender-Equality Index (GEI) for the fifth consecutive year"
10,Veladero Recognized as the First Argentine Mine to Complete the Implementation of the Towards Sustainable Mining Standard,"Veladero has become the first mine in the country to achieve compliance with the Towards Sustainable Mining (TSM) Standard, earning a special distinction from the Argentine Chamber of Mining (CAEM) during the Arminera 2023 summit, the industry's flagship event in the country."
10,Harmony reduces carbon footprint and lowers energy supply risk,"Johannesburg, Tuesday, 15 August 2023. Harmony Gold Mining Company Limited (“Harmony” and/or “the Company”) is pleased to announce that the 30 megawatt (MW) solar photovoltaic plants in the Free State have been commissioned. These plants are currently delivering green electrons to our shafts and expected to deliver approximately 70 gigawatt hours of renewable energy to Harmony’s Free State operations per annum. Phase 1 will reduce carbon dioxide emissions by approximately 65 000 tonnes in the first 12 months of operation."
10,Cobre Panama Supreme Court Update,"Franco-Nevada Corporation (“Franco-Nevada”) (TSX: FNV) (NYSE: FNV) is aware that the Supreme Court of Panama announced this morning that Law 406, the law that approved the revised concession contract for the Cobre Panama mine, is unconstitutional. Franco-Nevada is in communication with its partner First Quantum Minerals Ltd. and will provide further updates as they are available."
10,Barrick Responds to Globe and Mail Article on Payments Made by Barrick’s UK Subsidiary,"The Globe and Mail reported on payments made by Barrick’s UK subsidiary, Barrick TZ Limited, to a Tanzanian national law-enforcement task force, the NTF. The Globe and Mail’s article was based on documents that have been recently referenced in UK Court proceedings concerning claims for compensation by Tanzanian citizens arising from incidents that took place at the North Mara Mine in Tanzania between 2014 and 2019. The NTF is not a party to the UK proceedings nor is it alleged to have been involved in any of the incidents which took place at the North Mara Mine."
10,Franco-Nevada Provides Additional Update on Cobre Panama,"On January 26, 2023, the Panama Maritime Authority (the “AMP”) issued a resolution requiring the suspension of the concentrate loading operations at the Cobre Panama Port, Punta Rincón, until certification of the calibration of the scales by an accredited company had been initiated. First Quantum’s subsidiary, Minera Panama, S.A. (“MPSA”), the operator of Cobre Panama, submitted proof of the initiation of the certification process by an accredited company on February 3, 2023. Loading operations have been suspended while MPSA waits for a response from the AMP. If concentrate is not shipped by mid-February, it may be necessary for MPSA to suspend operations at Cobre Panama due to limited storage capacity on site."
10,Barrick’s Sustainable Delivery Centered on the Achievement of UN Sustainable Development Goals," Barrick Gold Corporation’s sustainability strategy is based on integrated and holistic management and aligned with the objectives of the United Nations’ Sustainable Development Goals (SDGs), that seeks to deliver outcomes that are achievable, demonstrable and align with global priorities, says president and chief executive Mark Bristow in the company’s 2022 Sustainability Report, published today"
10,Newmont Announces Canadian Competition Bureau Clearance for Acquisition of Newcrest,"Newmont Corporation today announced that the Canadian Competition Bureau issued a “no action” letter clearing Newmont’s previously announced transaction with Newcrest Mining Limited (ASX, TSX, PNGX: NCM) under Canadian competition law. Newmont is progressing towards receiving regulatory approvals in other jurisdictions for a transaction close expected in the fourth quarter."
10,Barrick Publishes GISTM TSF Disclosures," Barrick Gold Corporation today published site-level tailings storage facility (TSF) disclosures, in accordance with Principle 15 of the of the Global Industry Standard on Tailings Management (GISTM)."
10,Newmont CEO’s Statement on Pending Acquisition of Newcrest Achieving Legal Effectiveness in Australia,"Newmont Corporation’s (NYSE: NEM, TSX: NGT) President and Chief Executive Officer, Tom Palmer, today issued the following statement after the Scheme of Arrangement (“Scheme”), under which Newcrest Mining Limited (ASX, TSX, PNGX: NCM) will be acquired by Newmont, became legally effective under Australian law. This followed lodging of the orders of the Federal Court of Australia with the Australian Securities and Investments Commission after Newcrest’s shareholders voted in favor of the Scheme"
10,Cobre Panama Mining Concession Contract Enacted into Law in Panama,"Franco-Nevada Corporation  is pleased to announce that it has been advised by its partner First Quantum Minerals Ltd. (“First Quantum”) that, on October 20, 2023, Law 406, which approves the refreshed mining concession contract for the Cobre Panama mine, was enacted into law in Panama. First Quantum noted that the enactment of Law 406 marks the final step in revising the legal framework for the Cobre Panama mine."
10,Franco-Nevada Update on the Suspension of Ore Processing at Cobre Panama,"Franco-Nevada Corporation  has been advised by its partner First Quantum Minerals Ltd. (“First Quantum”) that First Quantum’s subsidiary, Minera Panama, S.A. (“MPSA”), has suspended ore processing operations at the Cobre Panama mine. As previously announced, the Panama Maritime Authority (“AMP”) issued a resolution on January 26, 2023 requiring the suspension of concentrate loading operations at the Cobre Panama Port, Punta Rincón, until certification of the calibration of the scales by an accredited company had been initiated. Key updates as reported by First Quantum include:"
10,Cobre Panama Environmental Stewardship Update,"(“First Quantum”), has provided an update in respect of its position regarding the next steps required for the responsible environmental stewardship of the Cobre Panama mine site and First Quantum’s intention to pursue all appropriate legal avenues to protect its investment and rights."
10,Newmont Announces End of Strike at Peñasquito Mine in Mexico,"Newmont focuses on a safe return-to-work plan and a quick ramp up of operations while strengthening workforce relationships. DENVER--(BUSINESS WIRE)-- Newmont Corporation (NYSE: NEM, TSX: NGT) announces it has reached a definitive agreement (“Agreement”) with the National Union of Mine, Metal, and Allied Workers of the Mexican Republic (the “Union”) to end the strike initiated by the Union on June 7, 2023, at the Company’s Peñasquito mine located in the Mexican state of Zacatecas. On October 13, 2023, Newmont and the Union submitted the Agreement to the Mexican Labor Court, which gave its approval, thus ending the strike"
10,Wheaton Precious Metals Publishes 2022 Sustainability Report Highlighting Commitment to Progress," Wheaton Precious Metals™ Corp. (""Wheaton"" or the ""Company"") is pleased to announce the publication of its 2022 Sustainability Report (the ""report"").  "
10,Alamos Gold Releases 2022 Annual ESG Report," Alamos Gold Inc. has released its annual Environmental, Social, and Governance (ESG) Report (“ESG Report”), which outlines the Company’s progress on its ESG performance in 2022 across its operations, projects and offices, and provides direction on planned initiatives for 2023."
10,Kinross releases 2022 Sustainability and ESG Report," Kinross Gold Corporation is pleased to announce the publication of its 2022 Sustainability and ESG Report (the “Report”), providing a comprehensive summary of the Company’s progress over the past year in furthering its Environmental, Social and Governance (ESG) strategy."
10,Pan American Silver Releases 2022 Sustainability Report,"Pan American Silver Corp. today released its 2022 Sustainability Report (the “Report”) describing Pan American’s approach and performance in the areas of environment, social and governance (“ESG”) in 2022. The Report also includes our 2023 goals for ESG performance. A Spanish version of the Report will be released shortly."
10,AngloGold Ashanti’s Renewable Energy Project at Tropicana to Halve Gas Consumption,"AngloGold Ashanti has taken another major step forward in its decarbonisation journey following an agreement by its subsidiary AngloGold Ashanti Australia Ltd to build one of the largest renewable energy projects in Australia’s natural resource sector, and to integrate it into the power supply for the Tropicana Gold Mine."
11,Alamos Gold Announces Significant Permitting Milestones at Lynn Lake Gold Project,"Alamos Gold Inc.  today announced that the federal Environmental Impact Assessment (“EIS”) for the Lynn Lake Gold Project (“Lynn Lake”) has been completed and a positive Decision Statement has been issued by the Minister of Environment and Climate Change Canada. As well, in accordance with the Environment Act, the Province of Manitoba has issued Environment Act Licenses for the MacLellan and Gordon sites."
6,Franco-Nevada Update on the Suspension of Ore Processing at Cobre Panama,"Franco-Nevada Corporation  has been advised by its partner First Quantum Minerals Ltd. (“First Quantum”) that First Quantum’s subsidiary, Minera Panama, S.A. (“MPSA”), has suspended ore processing operations at the Cobre Panama mine. As previously announced, the Panama Maritime Authority (“AMP”) issued a resolution on January 26, 2023 requiring the suspension of concentrate loading operations at the Cobre Panama Port, Punta Rincón, until certification of the calibration of the scales by an accredited company had been initiated. Key updates as reported by First Quantum include:"
11,Harmony’s Chairman and CEO meet with PNG Prime Minister to continue discussions on Wafi-Golpu permitting,"Harmony Gold Mining Company Limited’s (“Harmony” and/or “the Company”) Chairman, Dr Patrice Motsepe and its CEO, Peter Steenkamp met with Prime Minister James Marape on 26 July, to continue discussions on permitting the tier 1 copper-gold Wafi-Gold project in Papua New Guinea (“PNG”)."
11,Newmont Receives Clearance from Australia’s Competition Regulator to Acquire Newcrest,"Newmont Corporation today announced that following a review by the Australian Competition & Consumer Commission (ACCC), the agency has cleared the Company to proceed with its proposed acquisition of Newcrest Mining Limited (ASX, TSX, PNGX: NCM). The ACCC is expected to convey its clearance of the transaction to Australia’s Foreign Investment Review Board for consideration."
11,Franco-Nevada Provides Additional Update on Cobre Panama,"On January 26, 2023, the Panama Maritime Authority (the “AMP”) issued a resolution requiring the suspension of the concentrate loading operations at the Cobre Panama Port, Punta Rincón, until certification of the calibration of the scales by an accredited company had been initiated. First Quantum’s subsidiary, Minera Panama, S.A. (“MPSA”), the operator of Cobre Panama, submitted proof of the initiation of the certification process by an accredited company on February 3, 2023. Loading operations have been suspended while MPSA waits for a response from the AMP. If concentrate is not shipped by mid-February, it may be necessary for MPSA to suspend operations at Cobre Panama due to limited storage capacity on site."
11,Cobre Panama Mining Concession Contract Enacted into Law in Panama,"Franco-Nevada Corporation is pleased to announce that it has been advised by its partner First Quantum Minerals Ltd. (“First Quantum”) that, on October 20, 2023, Law 406, which approves the refreshed mining concession contract for the Cobre Panama mine, was enacted into law in Panama. First Quantum noted that the enactment of Law 406 marks the final step in revising the legal framework for the Cobre Panama mine."
0, ENDEAVOUR REPORTS STRONG FY-2022 RESULTS," Endeavour Mining plc is pleased to announce its FY-2022 operating and financial results, with highlights provided in Table 1 below."
8,ENDEAVOUR ACHIEVES TOP END OF FY-2022 GUIDANCE; ANNOUNCES H2-2022 DIVIDEND OF $100M,"Endeavour Mining plc  is pleased to announce its preliminary financial and operating results for the fourth quarter and full year 2022, with highlights provided in the table below."
0,ENDEAVOUR PUBLISHES 2022 ANNUAL REPORT,"Endeavour Mining plc announces that it has today published its 2022 Annual Report and audited financial statements for the financial year ended 31 December 2022, which is available on the Company's website at the following link."
2,ENDEAVOUR ANNOUNCES RENEWAL OF NORMAL COURSE ISSUER BID,"Endeavour Mining plchas received approval from the Toronto Stock Exchange (“TSX”) to renew its Normal Course Issuer Bid (“NCIB”) for its share repurchase programme, in order to continue to supplement its minimum progressive dividend."
10,ENDEAVOUR PUBLISHES 2022 SUSTAINABILITY REPORT,"Endeavour Mining plc is pleased to announce the publication of its 2022 Sustainability Report (“the Report”) with key environmental, social and governance (“ESG”) highlights presented in Table 1 below. "
7,ENDEAVOUR ANNOUNCES THE SALE OF ITS NON-CORE BOUNGOU AND WAHGNION MINES," Endeavour Mining plcis pleased to announce that it has today closed the sale of its 90% interests in its Boungou and Wahgnion non-core mines in Burkina Faso (the “Agreement”) to Lilium Mining, a subsidiary of Lilium Capital, an African and frontier markets focused strategic investment vehicle led by West African entrepreneurs. The total consideration is expected to exceed $300 million and is comprised of upfront and deferred cash considerations and net smelter return royalties (“NSR”), as detailed below"
0,Endeavour Reports Q2-2023 Results,Endeavour Reports Q2-2023 Results
3,Pan American Silver Announces Results of Annual General and Special Meeting,"Pan American Silver Corp. reported the voting results from its annual general and special meeting of shareholders held on May 10, 2023, in Vancouver, British Columbia (the “Meeting”). Each of the matters voted upon at the Meeting are described in detail in the Company’s Management Information Circular dated March 17, 2023"
3,AGNICO EAGLE ANNOUNCES ELECTION OF DIRECTORS,"Agnico Eagle Mines Limited today announced that, at the annual and special meeting of shareholders held on April 28, 2023 (the ""Meeting""), the eleven candidates presented as nominees to the board of directors at the Meeting were duly elected as directors of Agnico Eagle."
3,Alamos Gold Announces Results of the Annual General Meeting of Shareholders and Changes to its Board of Directors,"Alamos Gold Inc. today reported a summary of the voting results of its Annual General Meeting of Shareholders (the “Meeting”). The Company is also announcing the retirement of Kenneth Stowe from the Board of Directors, and the appointment of Shaun Usmar."
3,Results of Harmony’s 2023 Annual General Meeting," Harmony Gold Mining Company Limited advises shareholders that, at Harmony’s electronic annual general meeting held today, the requisite majority of shareholders approved all the ordinary and special resolutions, as set out in the notice of annual general meeting dated 25 October 2023, forming part of the Company’s 2023 report to shareholders and integrated annual report."
3,OSISKO ANNOUNCES RESULTS OF ANNUAL AND SPECIAL MEETING OF SHAREHOLDERS," Osisko Mining Inc. is pleased to announce the results of its annual and special meeting of shareholders (the “Meeting“) held earlier today. A total of 291,356,722 common shares of the Corporation were represented at the Meeting, representing approximately 75.9% of the total number of common shares of the Corporation issued and outstanding."
3,Eldorado Gold Announces Election of Directors and Voting Results from Annual Meeting of Shareholders,"Eldorado Gold Corporation (“Eldorado” or “the Company”) is pleased to announce that all director nominees, as listed in the Management Proxy Circular dated April 24, 2023, were elected as directors of Eldorado at the Company’s Annual Meeting of Shareholders (the “Meeting”) held on June 8, 2023."
3,IAMGOLD Announces Results of Annual Meeting of Shareholders,"IAMGOLD Corporation announces the voting results from the Company's Annual Meeting of Shareholders (the ""Meeting"") held Thursday, May 11, 2023. A summary of the results are as follows:"
3,Equinox Gold Announces Results from Annual General Meeting,"Equinox Gold Corp.  is pleased to announce that Equinox Gold shareholders approved all matters voted on at the annual general meeting held earlier today, including the election of management’s director nominees, the appointment of KPMG LLP as the Company’s independent auditor, and acceptance of the Company’s approach to executive compensation."
3,Orla Mining Reports Voting Results of Annual Shareholder Meeting,"Orla is pleased to report the voting results for the election of its Board of Directors, which took place at the Company’s Annual General and Special Meeting of Shareholders (“AGM”) held today. All nominees, as set forth in the Company’s Management Information Circular dated May 11, 2023 (“Circular”), were elected as directors of Orla at the AGM. Detailed results of the votes are set out below:"
3,Sandstorm Gold Royalties Announces Voting Results from 2023 Annual Shareholder Meeting and Renews ATM Program,Sandstorm Gold Ltd.is pleased to provide the voting results from the Company’s Annual General Meeting of Shareholders (the “Meeting”) and announce the renewal of the Company’s at-the-market equity program.
3,Centerra Gold Announces Results of 2023 Annual and Special Meeting of Shareholders ,"Centerra Gold Inc. is pleased to announce the results of its 2023 Annual and Special Meeting of Shareholders (the “Meeting”) held on May 9, 2023. A total of 218,703,496 shares, representing 70.95% of common shares issued and outstanding, were represented at the Meeting. Detailed voting results are outlined below."
24,"Gold price jumps past $2,000 as Israel-Hamas clash raises haven allure","Gold surged above $2,000 an ounce for the first time since May as concerns over conflict in the Middle East outweigh the impact of the recent jump in bond yields.Spot gold rose as much as 1.2% after Israel’s military said it was “expanding ground activity” in Gaza, putting the metal on course for the biggest monthly gain since July 2020. Prices touched an all-time high of $2,075.47 in 2020."
24,"Gold price nearing $2,000/oz as Middle East turmoil feeds safe haven demand","Gold price nearing $2,000/oz as Middle East turmoil feeds safe haven demand"
24,"Gold price could see new highs if Middle East conflict worsens, says Newmont CEO","Gold prices could well reach new record highs soon should the Hamas-Israel war continue to intensify, according to the world’s biggest gold miner’s chief executive Tom Palmer."
24,"Gold price stays near five-month high with Middle East conflict, US data in focus","Gold rebounded from an earlier week dip on Wednesday, as the safe-haven metal continues to be buoyed by the conflict in Middle East that looks to be far from resolved."
24,Gold price rises to 11-week high on escalating Middle East conflict,Gold jumped to its highest level since the beginning of August on Wednesday as the escalating conflict in the Middle East sent investors flocking towards the safe-haven metal.
24,"Israel’s ‘Black Sabbath’: Murder, Sexual Violence and Torture on Oct. 7",
24,Israel Expands Operations in Southern Gaza Amid Worsening Humanitarian Crisis,"Israeli forces expanded their military operations in the southern Gaza city of Khan Younis, intensifying efforts to kill Hamas’s top leadership, as aid agencies said the areas to which Israel has directed Palestinians to evacuate were increasingly overcrowded, short on resources and hit by Israeli strikes."
2,A quarterly dividend of $0.40 per share has been declared,"Agnico Eagle's Board of Directors has declared a quarterly cash dividend of $0.40 per common share, payable on December 15, 2023 to shareholders of record as of December 1, 2023. Agnico Eagle has declared a cash dividend every year since 1983."
2,"A cash dividend of $0.10 per common share with respect to Q3 2023 was declared on November 7, 2023, payable on or about December 1, 2023, to holders of record of Pan American’s common shares as of the close of markets on November 20, 2023. For the nine-months ended September 30, 2023, the Company paid cash dividends totaling $94.0 million. The dividends are eligible dividends for Canadian income tax purposes.","A cash dividend of $0.10 per common share with respect to Q3 2023 was declared on November 7, 2023, payable on or about December 1, 2023, to holders of record of Pan American’s common shares as of the close of markets on November 20, 2023. For the nine-months ended September 30, 2023, the Company paid cash dividends totaling $94.0 million. The dividends are eligible dividends for Canadian income tax purposes."
2,Sandstorm Gold Royalties Declares Dividend for First Quarter 2024,"Sandstorm Gold Ltd. (“Sandstorm Gold Royalties”, “Sandstorm” or the “Company”) (NYSE: SAND, TSX: SSL) is pleased to announce that its Board of Directors has declared the Company’s first quarterly cash dividend for 2024 in the amount of C$0.02 per common share to shareholders of record as of the close of business on January 16, 2024. The dividend will be paid on January 26, 2024. The dividend qualifies as an “eligible dividend” as defined in the Income Tax Act (Canada)."
2,Centerra Gold Announces Quarterly Dividend of C$0.07 per Common Share,Centerra Gold Announces Quarterly Dividend of C$0.07 per Common Share
10,Coeur Publishes 2022 ESG Report,"Coeur Mining, Inc. (“Coeur” or the “Company”) (NYSE: CDE) today published its 2022 ESG Report (the “Report”), highlighting the Company’s efforts to advance its environmental, social and governance practices and its responsible mining operations. The Report details Coeur’s public targets, best-in-class corporate governance practices and positive environmental and social impacts aligned with generating long-term value for stockholders."
9,IAMGOLD Appoints Bruno Lemelin as Chief Operating Officer,"IAMGOLD Corporation (TSX: IMG) (NYSE: IAG) (""IAMGOLD"" or the ""Company"") is pleased to announce that Mr. Bruno Lemelin has been appointed to the role of Chief Operating Officer effective immediately."
9,IAMGOLD Announces Director Retirement and Appointment of David Smith as Chair of the Board," IAMGOLD Corporation (TSX: IMG) (NYSE: IAG) (""IAMGOLD"" or the ""Company"") announced today that Maryse Bélanger has retired from the Company's Board of Directors (the ""Board"") for personal reasons and other commitments. Immediately following Ms. Bélanger's retirement, the Board has appointed David Smith to serve as Chair of the Board"
9,IAMGOLD Announces Appointment of Audra Walsh to The Board of Directors,"IAMGOLD Corporation (TSX: IMG) (NYSE: IAG) (""IAMGOLD"" or the ""Company"") today announced that Ms. Audra Walsh has been appointed to the Company's board of directors effective immediately."
9,Orla Mining Appoints Rob Krcmarov to its Board of Directors,(“Orla” or the “Company”) is pleased to announce the appointment of Mr. Rob Krcmarov as an independent Director of the Company effective immediately.
1,Orla Mining Amends Credit Facility,"(“Orla” or the “Company”) is pleased to announce that the Company has amended its existing US$150 million credit facility (the “Amended Credit Facility”) with its existing syndicate of lenders comprised of The Bank of Nova Scotia , Bank of Montreal , and Canadian Imperial Bank of Commerce. The Amended Credit Facility consists of a US$150 million revolving term facility."
9, (NYSE: ORLA) (“Orla” or the “Company”) is pleased to provide an update on its exploration activities on its South Railroad Project (“South Railroad” or “the project”) in 2022 and an overview of exploration plans for 2023 in Nevada, (NYSE: ORLA) (“Orla” or the “Company”) is pleased to provide an update on its exploration activities on its South Railroad Project (“South Railroad” or “the project”) in 2022 and an overview of exploration plans for 2023 in Nevada
6,Completion of the acquisition of the Bilboes gold project in Zimbabwe,"Caledonia Mining Corporation Plc (""Caledonia"" or the ""Company"") is pleased to announce that, following the satisfaction of conditions precedent, it has today completed the acquisition of Bilboes Gold Limited, the parent company which owns, through its Zimbabwe subsidiary, Bilboes Holdings (Private) Limited (""Bilboes Holdings""), the Bilboes gold project in Zimbabwe (""Bilboes"" or the ""Project"").  Please refer to Caledonia's announcement on July, 21 2022 for further details of the Project and the Transaction."
