Class Index,Title,Description
0,"Results for the Quarter ended March 31, 2023","Caledonia Mining Corporation Plc (""Caledonia"" or the ""Company"") announces its operating and financial results for the quarter ended March 31, 2023 (the ""Quarter"").  Further information on the financial and operating results for the Quarter can be found in the Management Discussion and Analysis (""MD&A"") and the unaudited interim financial statements which are available on the Company's website and which have been filed on SEDAR. "
1,Result of Placing,"Caledonia Mining Corporation Plc (""Caledonia"" or the ""Company"") is pleased to announce that, further to the announcement made at 7.05 a.m. today regarding the Fundraise (the ""Launch Announcement""), it has raised, subject to certain conditions, approximately £8.7 million (approximately US$10.6 million) before expenses under the Placing. The Placing received strong support from new and existing institutional investors. As announced in the Launch Announcement, it is expected that the Zimbabwe Placing will remain open until 12.00 p.m. on 31 March 2023 and a further announcement will be made in respect thereof in due course."
9,Osisko Board update, Osisko Gold Royalties Ltd (“Osisko” or the “Corporation”) (TSX and NYSE: OR) announced today that Mr. Sean Roosen has resigned as a director of the Corporation in order to focus all of his time and attention on his role as Chief Executive Officer and Chair of the Board of Directors of Osisko Development Corp.
2,Osisko Reports Q3 2023 Results,"Quarterly dividend of $0.06 per common share paid on October 16, 2023 to shareholders of record as of the close of business on September 29, 2023."
10,Osisko Publishes 2023 Asset Handbook Along With 2022 Sustainability Report,"Osisko Gold Royalties Ltd (the “Corporation” or “Osisko”) (OR: TSX & NYSE) is pleased to announce the publication of its annual Asset Handbook and the third edition of the Corporation’s Sustainability Report, Growing Responsibly"
2,Osisko Declares a 9% Increase in Quarterly Dividend,"Osisko Gold Royalties Ltd (the “Company” or “Osisko”) (OR: TSX & NYSE) is pleased to announce a second quarter 2023 dividend of C$0.060 per common share, a 9.1% increase over the first quarter of 2023, for an annualized dividend of $0.24 per share. The dividend will be paid on July 14, 2023 to shareholders of record as of the close of business on June 30, 2023. This dividend is an “eligible dividend” as defined in the Income Tax Act (Canada)."
6,Contango Completes Acquisition of HighGold,"Contango ORE, Inc. (NYSE American: CTGO) (“Contango” or the “Company”) and HighGold Mining Inc. (TSX-V:HIGH, OTCQX:HGMIF) (“HighGold”) are pleased to announce that Contango has completed its acquisition of HighGold (the “Acquisition”) by way of a court approved plan of arrangement under the Business Corporations Act (British Columbia) (the “BCBCA”). The Acquisition was overwhelmingly approved by HighGold securityholders in accordance with the requirements of the BCBCA at a special meeting of HighGold securityholders held on June 27, 2024, and was subsequently approved by the Supreme Court of British Columbia on July 2, 2024"
1,Contango ORE Announces Pricing of $15 Million Underwritten Public Offering,"Contango ORE, Inc. (""Contango"" or the ""Company"") (NYSE American: CTGO), today announced the pricing of its previously announced underwritten public offering (the ""Offering"") of 731,750 units (the ""Units"") of the Company at a price of $20.50 per Unit. Each Unit consists of (i) one share of the Company’s common stock and (ii) one-half of one accompanying warrant. Each whole accompanying warrant is exercisable to purchase one share of the Company’s common stock at a price of $26.00 per warrant, exercisable for a period of 36 months. The shares of common stock and warrants will be issued separately but can only be purchased together in the Offering. All of the Units in the Offering are to be sold by Contango."
3,"CONTANGO ORE, INC. Announces Results of the 2023 Virtual Annual Meeting of Stockholders and Results for the Quarter Ended September 30, 2023","Contango ORE, Inc. (""Contango"" or the ""Company"") (NYSE American: CTGO) announced today that the Company held its annual meeting of stockholders on November 14, 2023 and the following directors were elected to serve until the 2024 annual meeting of stockholders:"
