Class Index,Title,Description
4,"Alamos Gold Continues to Extend High-Grade Gold Mineralization Beyond Mineral Reserves and Resources at Puerto Del Aire, and Provides Regional Exploration Update at Mulatos","Alamos Gold Inc. (TSX:AGI; NYSE:AGI) (“Alamos” or the “Company”) today reported new results from ongoing surface exploration drilling within the Mulatos District. This included further extending high-grade gold mineralization outside of Mineral Reserves and Resources at Puerto Del Aire (“PDA”), a higher-grade underground deposit adjacent to the Mulatos pit. Additionally, gold mineralization was intersected over a wide interval at the Capulin target, located two-kilometres east of the former San Carlos open pit."
4,"Alamos Gold Reports One of the Best Holes Drilled to Date at Puerto Del Aire (33.40 g/t Au (11.48 g/t cut) over 25.95 m true width), Further Extending High-Grade Gold Mineralization Beyond Mineral Reserves and Resources"," Alamos Gold Inc. (TSX:AGI; NYSE:AGI) (“Alamos” or the “Company”) today reported new results from ongoing surface exploration drilling at Puerto Del Aire (“PDA”), further extending high-grade gold mineralization outside of Mineral Reserves and Resources. PDA is a higher-grade underground deposit, adjacent to the main Mulatos pit, and is comprised of five zones including PDA1, PDA2, Gap, Victor and Estrella. All reported composite widths are estimated true width of the mineralized zones."
4,"As Loulo-Gounkoto Sustains a Strong Performance, Barrick Hunts for New Discoveries in the Region","As Loulo-Gounkoto Sustains a Strong Performance, Barrick Hunts for New Discoveries in the Region"
4,Kinross announces robust initial mineral resource of 2.7 Moz. indicated and 2.3 Moz. inferred for Great Bear project,"TORONTO, Feb. 13, 2023 (GLOBE NEWSWIRE) -- Kinross Gold Corporation (TSX: K, NYSE: KGC) (“Kinross” or the “Company”) is pleased to announce an initial mineral resource estimate for its 100% owned Great Bear project located in Ontario, Canada."
4,Excellent recovered grades at Harmony’s South African underground mines boost second-quarter production,"Johannesburg, 1 February 2023. Harmony is pleased to announce that total gold production for the six-month period ended 31 December 2022 of financial year 2023 (“H1FY23”) was between 720 000 ounces (22 394kg) and 745 000 ounces (23 171kg)."
4,Successful Exploration Continues to Extend Tongon’s Life of Mine,"Originally scheduled for closure in 2020, the life of Barrick’s Tongon gold mine continues to be extended through successful exploration campaigns."
4,Alamos Gold Reports Mineral Reserves and Resources for the Year-Ended 2022,Alamos Gold Reports Mineral Reserves and Resources for the Year-Ended 2022
6,AGNICO EAGLE COMPLETES ACQUISITION OF YAMANA'S CANADIAN ASSETS,"Agnico Eagle Mines Limited  is pleased to announce the successful completion of the previously announced plan of arrangement (the ""Arrangement"") pursuant to which Agnico Eagle has acquired certain subsidiaries and partnerships which hold Yamana Gold Inc.'s (""Yamana"") interests in its Canadian assets, including the Canadian Malartic mine.  As part of the Arrangement, Pan American Silver Corp. has acquired all the issued and outstanding common shares of Yamana."
6,Gold Fields and AngloGold Ashanti propose Ghana JV to create Africa’s largest gold mine, Gold Fields and AngloGold Ashanti (“The Parties”) have agreed the key terms of a proposed joint venture in Ghana between Gold Fields’ Tarkwa and AngloGold Ashanti’s neighbouring Iduapriem mines (the “Proposed Joint Venture”).
6,Newmont Enters into Definitive Agreement to Acquire Newcrest,"Newmont has agreed to acquire Newcrest by way of an Australian Scheme of Arrangement (“Scheme”), under which Newmont will acquire 100 percent of the issued shares in Newcrest Mining Limited (“Newcrest”).Newcrest shareholders to receive 0.400 Newmont shares (or 0.400 Newmont CDI1) for each Newcrest share and a special dividend of up to $1.10 per share paid by Newcrest, representing a 30.4 percent premium2"
10,"Twiga Partnership Shows the Transformative Impact of Mining, Says Barrick","Barrick Gold Corporation and the Tanzanian government are demonstrating how mining can be an enormous force for good when miners and their host governments work together to create sustainable value for all stakeholders, says president and chief executive Mark Bristow."
11,Alamos Gold Announces Significant Permitting Milestones at Lynn Lake Gold Project,"Alamos Gold Inc.today announced that the federal Environmental Impact Assessment (“EIS”) for the Lynn Lake Gold Project (“Lynn Lake”) has been completed and a positive Decision Statement has been issued by the Minister of Environment and Climate Change Canada. As well, in accordance with the Environment Act, the Province of Manitoba has issued Environment Act Licenses for the MacLellan and Gordon sites."
6,AGNICO EAGLE ANNOUNCES INVESTMENT IN CANADA NICKEL COMPANY INC.," Agnico Eagle Mines Limited (NYSE: AEM) (TSX: AEM) (""Agnico Eagle"") announced today that it acquired 19,600,000 units (""Units"") of Canada Nickel Company Inc. (TSXV: CNC) (""Canada Nickel"") at a price of $1.18 per Unit for total consideration of approximately $23,128,000 from several sellers that acquired the Units in connection with an offering of flow-through Units by Canada Nickel (the ""Share Purchases""). "
6,Glencore to buy Pan American's Argentine copper mine stake for $475 million,"Glencore (GLEN.L), opens new tab on Monday agreed to buy Canadian miner Pan American Silver Corp's (PAAS.TO), opens new tab majority stake in an Argentine copper project for $475 million, as the Swiss commodities giant bulks up red metal that is expected to play a crucial role in the transition to greener economy."
6,Wheaton Precious Metals Announces the Acquisition of a Gold Stream from Lumina Gold's Cangrejos Project,"VANCOUVER, BC, May 16, 2023 /CNW/ - Wheaton Precious Metals™ Corp. (""Wheaton"" or the ""Company"") is pleased to announce that its wholly-owned subsidiary, Wheaton Precious Metals International Ltd. (""Wheaton International"") has entered into a definitive Precious Metal Purchase Agreement (the ""Gold Stream"") with Lumina Gold Corp. (""Lumina"") (TSXV: LUM) in respect to its 100% owned Cangrejos gold-copper project located in El Oro Province, Ecuador (the ""Project"" or ""Cangrejos""). Cangrejos is forecast to be a high-margin mine in the lowest half of the cost curve with a 26-year mine life1."
6,Alamos Gold Announces Acquisition of Manitou Gold More Than Tripling Land Package Adjacent to Island Gold Mine,"Alamos Gold Inc. (TSX:AGI; NYSE:AGI) (“Alamos” or the “Company”) is pleased to announce that it has entered into a definitive agreement (the “Agreement”) pursuant to which Alamos will acquire all of the issued and outstanding shares of Manitou Gold Inc. (TSX:MTU) (“Manitou”) by way of a court-approved plan of arrangement (the “Transaction”). The acquisition will consolidate Alamos’ existing ownership of Manitou shares and increase its regional land package around Island Gold with the addition of the Goudreau Property. This includes 40,000 hectares (“ha”) adjacent to and along strike from the Island Gold Mine, adding significant exploration potential across the relatively underexplored Michipicoten Greenstone Belt (see Figure 1). This is expected to increase Alamos’ land package around the Island Gold Deposit to 55,277 ha, a 267% increase."
6,"Newmont Acquires Newcrest, Successfully Creating World’s Leading Gold Mining Business","Newmont Corporation (NYSE: NEM, TSX: NGT, ASX: NEM, PNGX: NEM) today announced it has completed the acquisition of Newcrest Mining Limited to create the world’s leading gold company with robust copper production."
6,Goldrush Mine Gets Go-Ahead,"The US Bureau of Land Management has issued a Record of Decision (“ROD”) approving Nevada Gold Mines’ (“NGM”) plan of operations for its new Goldrush underground mine at the Cortez Complex near Beowawe, Nevada. The long-life mine is expected to start ramping up production in 2024 after the commissioning of the initial project infrastructure and is forecast to produce 130,000 ounces in 2024 and grow to approximately 400,000 ounces per annum by 2028 (100% basis)1."
6,"Wheaton Precious Metals Announces the Acquisition of Existing Streams from Orion Mine Finance Including the Platreef and Kudz Ze Kayah Projects, and Enters into a New Stream on the Curraghinalt Project","Wheaton Precious Metals™ Corp. (""Wheaton"" or the ""Company"") is pleased to announce Wheaton and its wholly-owned subsidiary, Wheaton Precious Metals International Ltd. (""Wheaton International"") have entered into a definitive agreement with certain entities advised by Orion Resource Partners (""Orion"") to acquire existing streams in respect of Ivanhoe Mines' Platreef Project (the ""Platreef Streams"") and BMC Minerals' Kudz Ze Kayah Project (the ""Kudz Ze Kayah Streams""). In addition, Wheaton International has entered into a new precious metals purchase agreement for a gold stream in respect of Dalradian Gold's Curraghinalt Project (the ""Curraghinalt Stream"")."
6,Mali gold exports rise 8.4% in 2022,"Mali is one of Africa's top gold producers and home to industrial mines operated by companies including Barrick Gold (ABX.TO), opens new tab, B2Gold Corp (BTO.TO), opens new tab, Resolute Mining (RSG.AX), opens new tab, AngloGold Ashanti (ANGJ.J), opens new tab and Hummingbird Resources (HUMR.L)"
6,Barrick Gold to invest nearly $2 bln in Zambia mine to raise copper output,"Barrick Gold (ABX.TO), opens new tab said on Wednesday it would invest nearly $2 billion as part of a project to increase copper production at its Lumwana mine in Zambia."
6,Barrick rules out rival bid for Australia's Newcrest - Bloomberg," Barrick Gold (ABX.TO), opens new tab has ruled out a counterbid for number-one Australian gold producer Newcrest Mining (NCM.AX), opens new tab, its chief executive told Bloomberg, eliminating what had seemed to be the most likely prospect of a rival to bidder Newmont (NEM.N)"
6,Ivory Coast 2022 gold output up 14% to record high,"Ivory Coast produced a record high of about 48 tonnes of gold in 2022, up 14% from the previous year, a document from the Ministry of Mines, Petrol and Energy showed. Ivory Coast, the world's top cocoa producer, is seeking to develop its long-neglected mining sector to diversify its revenue. Gold output has been climbing steadily for several years and is expected to reach 50 tonnes this year with the start of production from two mines belonging to Roxgold, owned by Fortuna (FVI.TO), opens new tab and Tietto Minerals (TIE.AX), opens new tab, according to the document seen by Reuters on Wednesday. Production is expected to reach 55 tonnes in 2024, when a new mine from Endeavour (EDV.L), opens new tab starts operating, it said. Other big gold mining companies operating in Ivory Coast include Barrick Gold (ABX.TO), opens new tab and Perseus Mining (PRU.AX), opens new tab."
6,Kinross announces ownership of shares of Allegiant Gold,"Kinross Gold Corporation announced today that it has acquired deemed beneficial ownership of 5,018,017 common shares of Allegiant Gold Ltd. "
6,New gold discoveries to extend Barrick's Ivory Coast mine operations," Barrick Gold Corp's , opens new tab Tongon mine in Ivory Coast will continue operating until at least 2030 following a significant discovery of new deposits, its director general said. The country's biggest industrial mine, located north of the port city of Abidjan, started production towards the end of 2010 and was due to close in 2020."
6,Newmont sees 'significant' shareholder value in buyout of gold rival Newcrest,"Several gold rivals have said in recent weeks they are not interested in large acquisitions, including Barrick, Gold Fields Ltd (GFIJ.J), opens new tab and Sibanye Stillwater Ltd (SSWJ.J)"
6,Barrick Announces Investment in Hercules Silver,"Barrick Gold Corporation (NYSE:GOLD)(TSX:ABX)(“Barrick”) announced today that it has agreed to subscribe for 21,265,370 units (“Units”) of Hercules Silver Corp. (“Hercules”) in a non-brokered private placement (“Private Placement”) at a price of $1.10 per Unit, for total consideration of $23,391,907. Each Unit is comprised of one common share and 0.32 of a common share purchase warrant, where each whole warrant will entitle the holder for a period of two years to acquire one Hercules common share at a price of $1.32 per common share."
6,Barrick Gold open to acquiring Newmont's share in Nevada joint venture," Barrick Gold (ABX.TO), opens new tab would be open to acquiring Newmont's minority stake in Nevada Gold Mines, a joint venture between the two gold miners majority-owned by Barrick, CEO Mark Bristow told Reuters on Wednesday"
6,Wheaton Precious Metals Announces the Acquisition of a New Silver Stream on the Mineral Park Mine,"Wheaton Precious Metals™ Corp. (""Wheaton"" or the ""Company"") is pleased to announce that its wholly-owned subsidiary, Wheaton Precious Metals International Ltd. (""WPMI"") has entered into a definitive Precious Metals Purchase Agreement (the ""Silver Stream"") with Waterton Copper Corp., a subsidiary of Waterton Copper LP (""Waterton Copper"") in respect to its 100% owned Mineral Park Mine located in Arizona, USA (the ""Project"" or ""Mineral Park"")"
6,Newmont Confirms Proposal to Combine with Newcrest," Newmont Corporation today confirmed it has submitted a non-binding proposal to acquire 100% of the issued share capital of Newcrest Mining Limited (Newcrest) by way of a scheme of arrangement. The proposed transaction would combine two of the sector’s top senior gold producers, and set the standard for sustainable and responsible gold mining."
6,Barrick Broadens Copper Base in Saudi Arabia,Barrick Gold Corporation  today signed new joint venture agreements with Ma’aden for two prospective exploration projects comprising the Jabal Sayid South and Umm Ad Damar license areas.
6,Newmont Reached a Preliminary Agreement with Peñasquito Mine’s Union,"Newmont Corporation confirms it has reached a preliminary agreement with the National Union of Mine, Metal, and Allied Workers of the Mexican Republic (the Union) aiming to end the strike initiated by the Union on June 7, 2023 at Minera Peñasquito in the Mexican state of Zacatecas."
6,Recommissioning Starts as Porgera Prepares to Resume Operations in Q1 2024," Following the formal completion of the Porgera Project Commencement Agreement today, work has started on the recommissioning of the Porgera gold mine in Papua New Guinea, which has been in care and maintenance since April 2020. This work is expected to be completed over the next few weeks, paving the way for mining and processing to restart in the first quarter of 2024."
6,Endeavour Mining expects more gold M&A,"More gold mergers and acquisitions are likely this year, Endeavour Mining CEO Sebastien de Montessus said, after Newmont’s $16.9 billion offer to buy Newcrest ramped up pressure on the sector to consider deals."
6,Pan American Silver Temporarily Suspends Operations at the La Colorada Mine,"Pan American Silver Corp. (NYSE: PAAS) (TSX: PAAS) (“Pan American”) has temporarily suspended all operating activities at its La Colorada mine in Mexico due to security concerns at the mine site and the surrounding area. In the early hours of October 5, 2023, the operation experienced an armed robbery of two trailers of concentrate. There were no physical injuries to our personnel in connection with the incident. In response to the current security situation in the area and Pan American’s priority to protect the safety and security of our personnel, Pan American has temporarily suspended operations, project work and exploration at La Colorada. The mine site is currently secure, and Pan American has activated care and maintenance activities while it works with state and federal authorities regarding this incident. The suspension will continue until Pan American determines it is appropriate to resume operation"
7,Barrick Gold to invest nearly $2 bln in Zambia mine to raise copper output,"Oct 4 (Reuters) - Barrick Gold (ABX.TO), opens new tab said on Wednesday it would invest nearly $2 billion as part of a project to increase copper production at its Lumwana mine in Zambia."
7,Barrick Keeps Key Projects On Track and Delivers Another Quarter of Improved Production and Costs,"Barrick’s Q3 results showed improved production at lower costs and confirmed its long term growth forecast. President and chief executive Mark Bristow said the Q3 performance was an improvement on the previous quarter’s and Q4 is expected to be better. Despite the projected second half improvement, gold production is forecast to be marginally below the low end of our annual guidance range. Copper is comfortably on track to meet its guidance for production and costs."
7,Kinross announces robust initial mineral resource of 2.7 Moz. indicated and 2.3 Moz. inferred for Great Bear project,"TORONTO, Feb. 13, 2023 (GLOBE NEWSWIRE) -- Kinross Gold Corporation (TSX: K, NYSE: KGC) (“Kinross” or the “Company”) is pleased to announce an initial mineral resource estimate for its 100% owned Great Bear project located in Ontario, Canada."
7,Alamos Gold Announces Appointment of Greg Fisher as Chief Financial Officer,"Alamos Gold Inc. (TSX:AGI; NYSE:AGI) (“Alamos” or the “Company”) today announced that Greg Fisher, Senior Vice President of Finance has been promoted to Chief Financial Officer effective May 1, 2023. Greg will succeed Jamie Porter who will be leaving Alamos to pursue another opportunity in the mining industry. Jamie will continue in his current capacity and help support the transition until April 28, 2023."
7,Excellent recovered grades at Harmony’s South African underground mines boost second-quarter production,"Johannesburg, 1 February 2023. Harmony is pleased to announce that total gold production for the six-month period ended 31 December 2022 of financial year 2023 (“H1FY23”) was between 720 000 ounces (22 394kg) and 745 000 ounces (23 171kg)."
7,"Barrick Gold reports higher gold, copper output for second quarter"," Canadian miner Barrick Gold (ABX.TO), opens new tab, said on Thursday its gold and copper production rose sequentially for the second quarter and that it remains on track to achieve full-year target."
7,Mali forecasts 3.5% decline in industrial gold output in 2023,"Mali expects industrial gold output to fall by about 3.5% to 63.9 tonnes in 2023 from 66.2 tonnes the previous year, the mines ministry said on Tuesday.Mali is one of Africa's top gold producers and home to industrial mines operated by companies including Barrick Gold (ABX.TO), opens new tab, B2Gold Corp (BTO.TO), opens new tab, Resolute Mining (RSG.AX), opens new tab, AngloGold Ashanti (ANGJ.J), opens new tab and Hummingbird Resources (HUMR.L)"
4,Newmont Announces Increased 2022 Mineral Reserves of 96 Million Gold Ounces and 68 Million Gold Equivalent Ounces," Newmont Corporation (NYSE: NEM, TSX: NGT) reported higher gold Mineral Reserves (""reserves"") of 96.1 million attributable ounces for 2022 compared to the Company’s 92.8 million ounces at the end of 2021. Newmont has significant upside to other metals, including more than 15 billion pounds of copper reserves and nearly 600 million ounces of silver reserves."
7,"Lower output, high costs to pressure Newmont, Barrick earnings","North American gold miners Newmont Corp (NEM.N), opens new tab and Barrick Gold Corp (ABX.TO), opens new tab are expected to post lower quarterly profits as a fall in production and higher costs offset gains from strong prices of the precious metal."
7,Barrick Reports Stronger Q4 Gold Production,"Barrick Gold Corporation (NYSE:GOLD)(TSX:ABX) (“Barrick” or the “Company”) today reported preliminary full year and fourth quarter 2022 production results. On the back of stronger Q4 production, 13% higher than the previous quarter, preliminary gold production for the full year of 4.14 million ounces was approximately 1% lower than the 4.2 million ounces1 previously guided, while preliminary copper production of 440 million pounds for 2022 was in line with the guidance range of 420 to 470 million pounds."
9,ANGLOGOLD ASHANTI ANNOUNCES CHANGES TO ITS BOARD OF DIRECTORS,"In compliance with paragraph 3.59(c) of the JSE Limited Listings Requirements, the board of AngloGold Ashanti is pleased to announce that Ms Diana Sands and Ms Jinhee Magie have been appointed as independent non-executive directors of the Company with effect from 1 June 2023. Ms Sands will serve as a member of the Remuneration and Human Resources Committee and Social, Ethics and Sustainability Committee and Ms Magie will serve as a member of the Audit and Risk Committee and Investment Committee."
9,RESIGNATION OF GROUP COMPANY SECRETARY,"In compliance with paragraph 3.59(b) of the Listings Requirements of JSE Limited, shareholders are advised that Ms Leeanne Goliath has resigned as Group Company Secretary of AngloGold Ashanti with effect from 20 July 2023 to pursue another opportunity. Ms Goliath will continue to fulfil her duties until 20 October 2023."
9,Alamos Gold Announces Results of the Annual General Meeting of Shareholders and Changes to its Board of Directors,"Alamos Gold Inc. (TSX:AGI; NYSE:AGI) (“Alamos” or the “Company”) today reported a summary of the voting results of its Annual General Meeting of Shareholders (the “Meeting”). The Company is also announcing the retirement of Kenneth Stowe from the Board of Directors, and the appointment of Shaun Usmar."
9,ANGLOGOLD ASHANTI ANNOUNCES RETIREMENT OF CHIEF OPERATING OFFICER,"AngloGold Ashanti today announced the retirement of Chief Operating Officer (COO) Ludwig Eybers in December this year. This comes after 12 years with the company, capping a nearly four-decade career in mining."
9,Newmont Announces Executive Leadership Appointments,"Newmont Corporation (NYSE: NEM, TSX: NGT) today announced leadership appointments that will further strengthen its operating model to support safe and profitable operations of the expanded portfolio of assets and projects."
9,Newmont Promotes Suzanne Retallack to Chief Safety and Sustainability Officer," Newmont Corporation (NYSE: NEM, TSX: NGT) announced today the promotion of experienced leader Suzanne Retallack as the Company’s Chief Safety and Sustainability Officer."
9,Franco-Nevada Announces Election of Directors,Franco-Nevada Corporation announced that the nominees listed in the management proxy circular for the 2023 Annual and Special Meeting of Shareholders were elected as directors of the Corporation. Detailed results of the vote for the election of directors held at the Annual Meeting yesterday in person and by webcast are set out below
9,ANGLOGOLD ASHANTI APPOINTS RICHARD JORDINSON CHIEF OPERATING OFFICER,"AngloGold Ashanti is pleased to announce the appointment of Richard Jordinson as Chief Operating Officer, with effect 1 October 2023."
9,Wheaton Precious Metals Confirm the Retirements of Eduardo Luna and John Brough from the Board of Directors,"Wheaton Precious Metals™ Corp. (""Wheaton"" or the ""Company"") announces the retirement of Mr. Eduardo Luna as part of the Company's board renewal program and the retirement of Mr. John Brough due to personal health reasons. Both directors intend to retire upon the completion of their terms at the upcoming 2023 annual general and special meeting of shareholders scheduled for May 12, 2023 (the ""Meeting"")."
9,Newmont Appoints Experienced Chief Financial Officer,"Newmont Corporation (NYSE: NEM, TSX: NGT) today announced the appointment of Karyn Ovelmen as Executive Vice President and Chief Financial Officer."
9,Wheaton Precious Metals Announces Election of Directors and Approval of Special Matters and Welcomes New Board Member,"Wheaton Precious Metals™ Corp. (""Wheaton"" or the ""Company"") announces that the nominees listed below were elected to the Board of Directors at the 2023 Annual and Special Meeting of Shareholders. Detailed results of the vote for the Board of Directors of the Company are shown below. As previously announced, Mr. Eduardo Luna and Mr. John Brough did not stand for re-election. In addition, Ms. Jeane Hull has been elected to the Board."
9,Newmont Announces Appointment of Mining Veteran Natascha Viljoen as Incoming Chief Operating Officer,"Newmont Corporation (NYSE: NEM, TSX: NGT) today announced that Natascha Viljoen will join the Company’s Executive Leadership Team as Executive Vice President and Chief Operating Officer upon completion of her notice period of up to 12 months."
10,Franco-Nevada Launches 2023 ESG Report and Asset Handbook,"Franco-Nevada Corporation (“Franco-Nevada” or the “Company”) (TSX:FNV) (NYSE:FNV) is pleased to announce publication of its 2023 ESG Report and 2023 Asset Handbook. “We are proud to report on our leading ESG approach, new programs and commitments and to provide a detailed review of our portfolio of assets,” said Paul Brink, President & CEO."
10,Wheaton Precious Metals Publishes Inaugural Climate Change Report,"Wheaton Precious Metals™ Corp. (""Wheaton"" or the ""Company"") is pleased to announce the publication of its inaugural 2022 Climate Change Report (the ""report""). The report was prepared in alignment with the recommendations of the Task Force on Climate-related Financial Disclosures (""TCFD"") and outlines how Wheaton is addressing climate change risks and opportunities and the resiliency of its portfolio to climate impacts."
